[
    {
        "id":  "altair-ibn-la-ahad",
        "name":  "Altair Ibn-La\u0027Ahad",
        "aliases":  [
                        "Altair",
                        "Altair Ibn La Ahad"
                    ],
        "first_game":  "Assassin\u0027s Creed",
        "year":  1191,
        "region":  "Levant",
        "faction":  "Assassin",
        "gender":  "M",
        "is_historical":  false,
        "image_url":  "/images/characters/altair-ibn-la-ahad.webp"
    },
    {
        "id":  "ezio-auditore-da-firenze",
        "name":  "Ezio Auditore da Firenze",
        "aliases":  [
                        "Ezio",
                        "Auditore"
                    ],
        "first_game":  "Assassin\u0027s Creed II",
        "year":  1476,
        "region":  "Italie",
        "faction":  "Assassin",
        "gender":  "M",
        "is_historical":  false,
        "image_url":  "/images/characters/ezio-auditore-da-firenze.webp"
    },
    {
        "id":  "desmond-miles",
        "name":  "Desmond Miles",
        "aliases":  [
                        "Desmond"
                    ],
        "first_game":  "Assassin\u0027s Creed",
        "year":  2012,
        "region":  "Etats-Unis",
        "faction":  "Assassin",
        "gender":  "M",
        "is_historical":  false,
        "image_url":  "/images/characters/desmond-miles.webp"
    },
    {
        "id":  "haytham-kenway",
        "name":  "Haytham Kenway",
        "aliases":  [
                        "Haytham"
                    ],
        "first_game":  "Assassin\u0027s Creed III",
        "year":  1754,
        "region":  "Amerique coloniale",
        "faction":  "Templier",
        "gender":  "M",
        "is_historical":  false,
        "image_url":  "/images/characters/haytham-kenway.webp"
    },
    {
        "id":  "ratonhnhake-ton",
        "name":  "Ratonhnhake:ton",
        "aliases":  [
                        "Connor",
                        "Connor Kenway"
                    ],
        "first_game":  "Assassin\u0027s Creed III",
        "year":  1769,
        "region":  "Amerique coloniale",
        "faction":  "Assassin",
        "gender":  "M",
        "is_historical":  false,
        "image_url":  "/images/characters/ratonhnhake-ton.webp"
    },
    {
        "id":  "edward-kenway",
        "name":  "Edward Kenway",
        "aliases":  [
                        "Edward"
                    ],
        "first_game":  "Assassin\u0027s Creed IV: Black Flag",
        "year":  1715,
        "region":  "Caraibes",
        "faction":  "Assassin",
        "gender":  "M",
        "is_historical":  false,
        "image_url":  "/images/characters/edward-kenway.webp"
    },
    {
        "id":  "adewale",
        "name":  "Adewale",
        "aliases":  [
                        "Adewale",
                        "Adewale"
                    ],
        "first_game":  "Assassin\u0027s Creed IV: Black Flag",
        "year":  1715,
        "region":  "Caraibes",
        "faction":  "Assassin",
        "gender":  "M",
        "is_historical":  false,
        "image_url":  "/images/characters/adewale.webp"
    },
    {
        "id":  "shay-patrick-cormac",
        "name":  "Shay Patrick Cormac",
        "aliases":  [
                        "Shay",
                        "Cormac"
                    ],
        "first_game":  "Assassin\u0027s Creed Rogue",
        "year":  1752,
        "region":  "Atlantique Nord",
        "faction":  "Templier",
        "gender":  "M",
        "is_historical":  false,
        "image_url":  "/images/characters/shay-patrick-cormac.webp"
    },
    {
        "id":  "arno-victor-dorian",
        "name":  "Arno Victor Dorian",
        "aliases":  [
                        "Arno"
                    ],
        "first_game":  "Assassin\u0027s Creed Unity",
        "year":  1789,
        "region":  "France",
        "faction":  "Assassin",
        "gender":  "M",
        "is_historical":  false,
        "image_url":  "/images/characters/arno-victor-dorian.webp"
    },
    {
        "id":  "elise-de-la-serre",
        "name":  "Elise de la Serre",
        "aliases":  [
                        "Elise"
                    ],
        "first_game":  "Assassin\u0027s Creed Unity",
        "year":  1789,
        "region":  "France",
        "faction":  "Templier",
        "gender":  "F",
        "is_historical":  false,
        "image_url":  "/images/characters/elise-de-la-serre.webp"
    },
    {
        "id":  "jacob-frye",
        "name":  "Jacob Frye",
        "aliases":  [
                        "Jacob"
                    ],
        "first_game":  "Assassin\u0027s Creed Syndicate",
        "year":  1868,
        "region":  "Angleterre",
        "faction":  "Assassin",
        "gender":  "M",
        "is_historical":  false,
        "image_url":  "/images/characters/jacob-frye.webp"
    },
    {
        "id":  "evie-frye",
        "name":  "Evie Frye",
        "aliases":  [
                        "Evie"
                    ],
        "first_game":  "Assassin\u0027s Creed Syndicate",
        "year":  1868,
        "region":  "Angleterre",
        "faction":  "Assassin",
        "gender":  "F",
        "is_historical":  false,
        "image_url":  "/images/characters/evie-frye.webp"
    },
    {
        "id":  "bayek-de-siwa",
        "name":  "Bayek de Siwa",
        "aliases":  [
                        "Bayek"
                    ],
        "first_game":  "Assassin\u0027s Creed Origins",
        "year":  -49,
        "region":  "Egypte",
        "faction":  "Hidden Ones",
        "gender":  "M",
        "is_historical":  false,
        "image_url":  "/images/characters/bayek-de-siwa.webp"
    },
    {
        "id":  "aya-de-alexandrie",
        "name":  "Aya de Alexandrie",
        "aliases":  [
                        "Aya",
                        "Amunet"
                    ],
        "first_game":  "Assassin\u0027s Creed Origins",
        "year":  -48,
        "region":  "Egypte",
        "faction":  "Hidden Ones",
        "gender":  "F",
        "is_historical":  false,
        "image_url":  "/images/characters/aya-de-alexandrie.webp"
    },
    {
        "id":  "kassandra",
        "name":  "Kassandra",
        "aliases":  [
                        "Kassandra of Sparta"
                    ],
        "first_game":  "Assassin\u0027s Creed Odyssey",
        "year":  -431,
        "region":  "Grece",
        "faction":  "Misthios",
        "gender":  "F",
        "is_historical":  false,
        "image_url":  "/images/characters/kassandra.webp"
    },
    {
        "id":  "alexios",
        "name":  "Alexios",
        "aliases":  [
                        "Alexios of Sparta"
                    ],
        "first_game":  "Assassin\u0027s Creed Odyssey",
        "year":  -431,
        "region":  "Grece",
        "faction":  "Misthios",
        "gender":  "M",
        "is_historical":  false,
        "image_url":  "/images/characters/alexios.webp"
    },
    {
        "id":  "eivor-varinsdottir",
        "name":  "Eivor Varinsdottir",
        "aliases":  [
                        "Eivor",
                        "Wolf-Kissed"
                    ],
        "first_game":  "Assassin\u0027s Creed Valhalla",
        "year":  873,
        "region":  "Norvege / Angleterre",
        "faction":  "Raven Clan",
        "gender":  "F",
        "is_historical":  false,
        "image_url":  "/images/characters/eivor-varinsdottir.webp"
    },
    {
        "id":  "basim-ibn-ishaq",
        "name":  "Basim Ibn Ishaq",
        "aliases":  [
                        "Basim"
                    ],
        "first_game":  "Assassin\u0027s Creed Valhalla",
        "year":  872,
        "region":  "Bagdad",
        "faction":  "Hidden Ones",
        "gender":  "M",
        "is_historical":  false,
        "image_url":  "/images/characters/basim-ibn-ishaq.webp"
    },
    {
        "id":  "roshan",
        "name":  "Roshan",
        "aliases":  [
                        "Roshan of Baghdad"
                    ],
        "first_game":  "Assassin\u0027s Creed Mirage",
        "year":  861,
        "region":  "Bagdad",
        "faction":  "Hidden Ones",
        "gender":  "F",
        "is_historical":  false,
        "image_url":  "/images/characters/roshan.webp"
    },
    {
        "id":  "leonardo-da-vinci",
        "name":  "Leonardo da Vinci",
        "aliases":  [
                        "Leonard de Vinci",
                        "Da Vinci"
                    ],
        "first_game":  "Assassin\u0027s Creed II",
        "year":  1482,
        "region":  "Italie",
        "faction":  "Allie",
        "gender":  "M",
        "is_historical":  true,
        "image_url":  "/images/characters/leonardo-da-vinci.webp"
    }
]
